{"catalogVersion":"2026-09-20.1","contractVersion":"xolosarmy-public-roadmap/1.0.0","generatedAt":"2026-09-20T18:13:26Z","observedAt":"2026-09-20T18:13:26Z","projects":[{"id":"ecash-magazine","lastUpdate":"2026-09-20T00:00:00Z","name":"eCash Magazine","phase":"Ops","priority":"P2","securityStatus":"NOT_REPORTED","status":"ACTIVE"},{"id":"ecash-mexico","lastUpdate":"2026-09-05T23:59:00Z","name":"eCash México","phase":"Ops","priority":"P2","securityStatus":"NOT_REPORTED","status":"ACTIVE"},{"id":"tonalli-contracts","lastUpdate":"2026-08-20T15:38:00Z","name":"Tonalli Contracts","phase":"0/Core","priority":"P0","securityStatus":"REPORTED_PASS","status":"FROZEN"},{"id":"tonalli-memo","lastUpdate":"2026-09-16T18:31:00Z","name":"Tonalli Memo","phase":"A","priority":"P1","securityStatus":"CONDITIONAL","status":"ACTIVE"},{"id":"tonalli-wallet","lastUpdate":"2026-09-20T17:28:00Z","name":"Tonalli Wallet","phase":"A","priority":"P0","securityStatus":"CONDITIONAL","status":"REVIEW"},{"id":"tonalli-website","lastUpdate":"2026-08-20T15:38:00Z","name":"Tonalli Website","phase":"Ops","priority":"P2","securityStatus":"NOT_REPORTED","status":"MAINTENANCE"},{"id":"x402-xec","lastUpdate":"2026-09-20T17:28:00Z","name":"x402-XEC","phase":"C","priority":"P1","securityStatus":"CONDITIONAL","status":"REVIEW"},{"id":"xolos-ramirez","lastUpdate":"2026-09-20T17:28:00Z","name":"Xolos Ramírez","phase":"Ops","priority":"P2","securityStatus":"NOT_REPORTED","status":"ACTIVE"}],"snapshotId":"2edabb015a79f3f66a63f02d14a01cb15814c2e26e4b5e02cfdd564ab94ce734"}
